{
  "id": "email-deliverability",
  "version": "1.0.0",
  "name": "Email Deliverability Standards",
  "description": "Technical standards for email deliverability and authentication",
  "type": "checks",
  "status": "active",
  "maintainers": [],
  "tags": [
    "email",
    "deliverability",
    "technical",
    "authentication"
  ],
  "first_published": "2025-12-29",
  "last_updated": "2025-12-29",
  "seo": {
    "title": "Email Deliverability Standards v1.0.0 | lksy.org",
    "description": "Technical standards for email deliverability and authentication. Free, open source, version-controlled community standards.",
    "keywords": [
      "email",
      "deliverability",
      "technical",
      "authentication",
      "community standards",
      "qa standards"
    ]
  },
  "checks": [
    {
      "id": "spf-record-exists",
      "name": "SPF record exists",
      "severity": "critical",
      "description": "Sender Policy Framework configured",
      "rationale": "Based on SPF (RFC 7208)",
      "automatable": true,
      "detection_method": "protocol_check",
      "false_positive_rate": "very_low",
      "status": "approved"
    },
    {
      "id": "dkim-signature-present",
      "name": "DKIM signature present",
      "severity": "critical",
      "description": "DomainKeys Identified Mail configured",
      "rationale": "Based on DKIM (RFC 6376)",
      "automatable": true,
      "detection_method": "protocol_check",
      "false_positive_rate": "very_low",
      "status": "approved"
    },
    {
      "id": "dmarc-record-exists",
      "name": "DMARC record exists",
      "severity": "critical",
      "description": "Domain-based Message Auth configured",
      "rationale": "Based on DMARC (RFC 7489)",
      "automatable": true,
      "detection_method": "protocol_check",
      "false_positive_rate": "very_low",
      "status": "approved"
    },
    {
      "id": "list-unsubscribe-header",
      "name": "List-Unsubscribe header",
      "severity": "major",
      "description": "One-click unsubscribe support",
      "rationale": "Based on RFC 2369",
      "automatable": true,
      "detection_method": "protocol_check",
      "false_positive_rate": "very_low",
      "status": "approved"
    },
    {
      "id": "valid-from-address",
      "name": "Valid From address",
      "severity": "critical",
      "description": "From address matches sending domain",
      "rationale": "Based on RFC 5322",
      "automatable": true,
      "detection_method": "protocol_check",
      "false_positive_rate": "very_low",
      "status": "approved"
    },
    {
      "id": "text-to-image-ratio-60-40",
      "name": "Text-to-image ratio 60:40",
      "severity": "major",
      "description": "Avoid image-only emails",
      "rationale": "Based on Best Practice",
      "automatable": true,
      "detection_method": "protocol_check",
      "false_positive_rate": "very_low",
      "status": "approved"
    },
    {
      "id": "no-excessive-spam-words",
      "name": "No excessive spam words",
      "severity": "major",
      "description": "Limit spam trigger words",
      "rationale": "Based on Best Practice",
      "automatable": true,
      "detection_method": "protocol_check",
      "false_positive_rate": "very_low",
      "status": "approved"
    },
    {
      "id": "proper-message-id",
      "name": "Proper Message-ID",
      "severity": "minor",
      "description": "Unique message identifier",
      "rationale": "Based on RFC 5322",
      "automatable": true,
      "detection_method": "protocol_check",
      "false_positive_rate": "very_low",
      "status": "approved"
    }
  ]
}