{
  "id": "email-spam-triggers",
  "version": "1.0.0",
  "name": "Email Spam Triggers",
  "description": "Words and patterns that trigger email spam filters",
  "type": "checks",
  "status": "active",
  "maintainers": [],
  "tags": [
    "email",
    "deliverability",
    "spam",
    "content"
  ],
  "first_published": "2025-12-29",
  "last_updated": "2025-12-29",
  "seo": {
    "title": "Email Spam Triggers v1.0.0 | lksy.org",
    "description": "Words and patterns that trigger email spam filters. Free, open source, version-controlled community standards.",
    "keywords": [
      "email",
      "deliverability",
      "spam",
      "content",
      "community standards",
      "qa standards"
    ]
  },
  "checks": [
    {
      "id": "free",
      "name": "FREE",
      "severity": "critical",
      "description": "Especially in ALL CAPS",
      "rationale": "Category: Money/Offers",
      "automatable": true,
      "false_positive_rate": "medium",
      "status": "approved"
    },
    {
      "id": "click-here",
      "name": "Click here",
      "severity": "major",
      "description": "Better: Use descriptive link text",
      "rationale": "Category: Urgency",
      "automatable": true,
      "false_positive_rate": "medium",
      "status": "approved"
    },
    {
      "id": "act-now",
      "name": "Act now",
      "severity": "critical",
      "description": "High-pressure language",
      "rationale": "Category: Urgency",
      "automatable": true,
      "false_positive_rate": "low",
      "status": "approved"
    },
    {
      "id": "limited-time",
      "name": "Limited time",
      "severity": "major",
      "description": "OK if true",
      "rationale": "Category: Urgency",
      "automatable": true,
      "false_positive_rate": "medium",
      "status": "approved"
    },
    {
      "id": "make-money-fast",
      "name": "Make money fast",
      "severity": "critical",
      "description": "Classic spam phrase",
      "rationale": "Category: Money/Offers",
      "automatable": true,
      "false_positive_rate": "low",
      "status": "approved"
    },
    {
      "id": "no-credit-card",
      "name": "No credit card",
      "severity": "major",
      "description": "Financial trigger",
      "rationale": "Category: Money/Offers",
      "automatable": true,
      "false_positive_rate": "medium",
      "status": "approved"
    },
    {
      "id": "100--free",
      "name": "100% free",
      "severity": "critical",
      "description": "Excessive claim",
      "rationale": "Category: Money/Offers",
      "automatable": true,
      "false_positive_rate": "low",
      "status": "approved"
    },
    {
      "id": "dear-friend",
      "name": "Dear friend",
      "severity": "major",
      "description": "Generic greeting",
      "rationale": "Category: Greeting",
      "automatable": true,
      "false_positive_rate": "low",
      "status": "approved"
    },
    {
      "id": "you-re-a-winner",
      "name": "You're a winner",
      "severity": "critical",
      "description": "Classic spam",
      "rationale": "Category: Money/Offers",
      "automatable": true,
      "false_positive_rate": "low",
      "status": "approved"
    },
    {
      "id": "cash-bonus",
      "name": "Cash bonus",
      "severity": "critical",
      "description": "Financial incentive",
      "rationale": "Category: Money/Offers",
      "automatable": true,
      "false_positive_rate": "low",
      "status": "approved"
    },
    {
      "id": "buy-now",
      "name": "Buy now",
      "severity": "major",
      "description": "OK for legitimate offers",
      "rationale": "Category: Urgency",
      "automatable": true,
      "false_positive_rate": "medium",
      "status": "approved"
    },
    {
      "id": "congratulations",
      "name": "Congratulations",
      "severity": "major",
      "description": "Context dependent",
      "rationale": "Category: Money/Offers",
      "automatable": true,
      "false_positive_rate": "medium",
      "status": "approved"
    },
    {
      "id": "increase-sales",
      "name": "Increase sales",
      "severity": "minor",
      "description": "Legitimate B2B",
      "rationale": "Category: Business",
      "automatable": true,
      "false_positive_rate": "medium",
      "status": "approved"
    },
    {
      "id": "earn-extra-cash",
      "name": "Earn extra cash",
      "severity": "critical",
      "description": "Work-from-home spam",
      "rationale": "Category: Money/Offers",
      "automatable": true,
      "false_positive_rate": "low",
      "status": "approved"
    },
    {
      "id": "risk-free",
      "name": "Risk-free",
      "severity": "major",
      "description": "Avoid absolute claims",
      "rationale": "Category: Money/Offers",
      "automatable": true,
      "false_positive_rate": "medium",
      "status": "approved"
    }
  ]
}
