{
  "id": "email-accessibility",
  "version": "1.0.0",
  "name": "Email Accessibility Standards",
  "description": "WCAG-compliant accessibility checks for email content",
  "type": "checks",
  "status": "active",
  "maintainers": [],
  "tags": [
    "email",
    "accessibility",
    "wcag",
    "a11y"
  ],
  "first_published": "2025-12-29",
  "last_updated": "2025-12-29",
  "seo": {
    "title": "Email Accessibility Standards v1.0.0 | lksy.org",
    "description": "WCAG-compliant accessibility checks for email content. Free, open source, version-controlled community standards.",
    "keywords": [
      "email",
      "accessibility",
      "wcag",
      "a11y",
      "community standards",
      "qa standards"
    ]
  },
  "checks": [
    {
      "id": "1-1-1",
      "name": "Non-text content has alt text",
      "severity": "critical",
      "description": "All images must have alt attributes",
      "rationale": "WCAG A compliance",
      "automatable": true,
      "false_positive_rate": "low",
      "status": "approved"
    },
    {
      "id": "1-4-3",
      "name": "Contrast minimum (4.5:1)",
      "severity": "critical",
      "description": "Text must have 4.5:1 contrast ratio",
      "rationale": "WCAG AA compliance",
      "automatable": true,
      "false_positive_rate": "low",
      "status": "approved"
    },
    {
      "id": "1-4-11",
      "name": "Non-text contrast (3:1)",
      "severity": "major",
      "description": "UI components need 3:1 contrast",
      "rationale": "WCAG AA compliance",
      "automatable": true,
      "false_positive_rate": "low",
      "status": "approved"
    },
    {
      "id": "2-1-1",
      "name": "Keyboard accessible",
      "severity": "critical",
      "description": "All functionality available via keyboard",
      "rationale": "WCAG A compliance",
      "automatable": false,
      "false_positive_rate": "low",
      "status": "approved"
    },
    {
      "id": "2-4-1",
      "name": "Bypass blocks",
      "severity": "major",
      "description": "Skip navigation links present",
      "rationale": "WCAG A compliance",
      "automatable": true,
      "false_positive_rate": "low",
      "status": "approved"
    },
    {
      "id": "2-4-4",
      "name": "Link purpose",
      "severity": "major",
      "description": "Link text describes destination",
      "rationale": "WCAG A compliance",
      "automatable": false,
      "false_positive_rate": "low",
      "status": "approved"
    },
    {
      "id": "3-1-1",
      "name": "Language of page",
      "severity": "critical",
      "description": "HTML lang attribute present",
      "rationale": "WCAG A compliance",
      "automatable": true,
      "false_positive_rate": "low",
      "status": "approved"
    },
    {
      "id": "3-2-2",
      "name": "On input",
      "severity": "major",
      "description": "Input doesn't cause unexpected context change",
      "rationale": "WCAG A compliance",
      "automatable": false,
      "false_positive_rate": "low",
      "status": "approved"
    },
    {
      "id": "4-1-2",
      "name": "Name, role, value",
      "severity": "critical",
      "description": "Form inputs have proper labels",
      "rationale": "WCAG A compliance",
      "automatable": true,
      "false_positive_rate": "low",
      "status": "approved"
    }
  ]
}
