{
  "id": "crm-data-quality",
  "version": "1.0.0",
  "name": "CRM Data Quality Standards",
  "description": "Data quality checks for CRM records",
  "type": "checks",
  "status": "active",
  "maintainers": [],
  "tags": ["sales", "crm", "data-quality"],
  "first_published": "2025-01-21",
  "last_updated": "2025-01-21",
  "seo": {
    "title": "CRM Data Quality Standards v1.0.0 | lksy.org",
    "description": "20 data quality checks for CRM records to ensure data accuracy and completeness.",
    "keywords": ["crm data quality", "salesforce", "crm standards", "data quality"]
  },
  "checks": [
    {
      "id": "email-format",
      "name": "Email Format Valid",
      "severity": "critical",
      "description": "Verify email address is in valid format",
      "rationale": "Invalid emails cannot be used for outreach",
      "automatable": true,
      "detection_method": "regex",
      "false_positive_rate": "very_low",
      "status": "approved"
    },
    {
      "id": "email-domain",
      "name": "Email Domain Valid",
      "severity": "major",
      "description": "Verify email domain exists and has MX records",
      "rationale": "Invalid domains indicate bad data",
      "automatable": true,
      "detection_method": "dns_lookup",
      "false_positive_rate": "low",
      "status": "approved"
    },
    {
      "id": "phone-format",
      "name": "Phone Format Valid",
      "severity": "major",
      "description": "Verify phone number is in valid format",
      "rationale": "Invalid phone numbers cannot be used",
      "automatable": true,
      "detection_method": "regex",
      "false_positive_rate": "low",
      "status": "approved"
    },
    {
      "id": "name-complete",
      "name": "Name Complete",
      "severity": "critical",
      "description": "Verify first name and last name are present",
      "rationale": "Incomplete names reduce personalization",
      "automatable": true,
      "detection_method": "field_validation",
      "false_positive_rate": "very_low",
      "status": "approved"
    },
    {
      "id": "company-name",
      "name": "Company Name Present",
      "severity": "critical",
      "description": "Verify company name is present for account records",
      "rationale": "Company name is essential for B2B records",
      "automatable": true,
      "detection_method": "field_validation",
      "false_positive_rate": "very_low",
      "status": "approved"
    },
    {
      "id": "address-complete",
      "name": "Address Complete",
      "severity": "minor",
      "description": "Verify address fields are complete if address is provided",
      "rationale": "Incomplete addresses are less useful",
      "automatable": true,
      "detection_method": "field_validation",
      "false_positive_rate": "low",
      "status": "approved"
    },
    {
      "id": "no-duplicates",
      "name": "No Duplicate Records",
      "severity": "critical",
      "description": "Verify no duplicate records exist (same email or phone)",
      "rationale": "Duplicates cause data quality issues",
      "automatable": true,
      "detection_method": "duplicate_detection",
      "false_positive_rate": "low",
      "status": "approved"
    },
    {
      "id": "job-title-present",
      "name": "Job Title Present",
      "severity": "major",
      "description": "Verify job title is present for contact records",
      "rationale": "Job title helps with lead qualification",
      "automatable": true,
      "detection_method": "field_validation",
      "false_positive_rate": "very_low",
      "status": "approved"
    },
    {
      "id": "industry-classified",
      "name": "Industry Classified",
      "severity": "recommended",
      "description": "Verify industry is classified for account records",
      "rationale": "Industry helps with segmentation",
      "automatable": true,
      "detection_method": "field_validation",
      "false_positive_rate": "very_low",
      "status": "approved"
    },
    {
      "id": "company-size",
      "name": "Company Size",
      "severity": "recommended",
      "description": "Verify company size is set for account records",
      "rationale": "Company size helps with lead qualification",
      "automatable": true,
      "detection_method": "field_validation",
      "false_positive_rate": "very_low",
      "status": "approved"
    },
    {
      "id": "lead-source",
      "name": "Lead Source",
      "severity": "major",
      "description": "Verify lead source is tracked",
      "rationale": "Lead source is essential for attribution",
      "automatable": true,
      "detection_method": "field_validation",
      "false_positive_rate": "very_low",
      "status": "approved"
    },
    {
      "id": "no-test-data",
      "name": "No Test Data",
      "severity": "critical",
      "description": "Verify no test data (test@, example.com, etc.)",
      "rationale": "Test data pollutes production data",
      "automatable": true,
      "detection_method": "pattern_matching",
      "false_positive_rate": "very_low",
      "status": "approved"
    },
    {
      "id": "no-placeholder-text",
      "name": "No Placeholder Text",
      "severity": "major",
      "description": "Verify no placeholder text (N/A, TBD, etc.)",
      "rationale": "Placeholder text indicates incomplete data",
      "automatable": true,
      "detection_method": "pattern_matching",
      "false_positive_rate": "medium",
      "status": "approved"
    },
    {
      "id": "website-url-valid",
      "name": "Website URL Valid",
      "severity": "minor",
      "description": "Verify website URL is valid and accessible",
      "rationale": "Invalid URLs indicate bad data",
      "automatable": true,
      "detection_method": "url_validation",
      "false_positive_rate": "medium",
      "status": "approved"
    },
    {
      "id": "linkedin-url-valid",
      "name": "LinkedIn URL Valid",
      "severity": "recommended",
      "description": "Verify LinkedIn URL is valid format if provided",
      "rationale": "Invalid LinkedIn URLs indicate bad data",
      "automatable": true,
      "detection_method": "url_validation",
      "false_positive_rate": "low",
      "status": "approved"
    },
    {
      "id": "last-activity-date",
      "name": "Last Activity Date",
      "severity": "recommended",
      "description": "Verify last activity date is tracked",
      "rationale": "Activity dates help with lead scoring",
      "automatable": true,
      "detection_method": "field_validation",
      "false_positive_rate": "very_low",
      "status": "approved"
    },
    {
      "id": "owner-assigned",
      "name": "Owner Assigned",
      "severity": "critical",
      "description": "Verify record owner is assigned",
      "rationale": "Unassigned records cannot be worked",
      "automatable": true,
      "detection_method": "field_validation",
      "false_positive_rate": "very_low",
      "status": "approved"
    },
    {
      "id": "stage-progression",
      "name": "Stage Progression Valid",
      "severity": "major",
      "description": "Verify stage progression follows logical order",
      "rationale": "Invalid stage progression indicates data issues",
      "automatable": true,
      "detection_method": "workflow_validation",
      "false_positive_rate": "low",
      "status": "approved"
    },
    {
      "id": "amount-valid",
      "name": "Amount Valid",
      "severity": "major",
      "description": "Verify deal amount is positive number if stage is closed-won",
      "rationale": "Closed-won deals should have amounts",
      "automatable": true,
      "detection_method": "field_validation",
      "false_positive_rate": "very_low",
      "status": "approved"
    },
    {
      "id": "close-date-valid",
      "name": "Close Date Valid",
      "severity": "major",
      "description": "Verify close date is in future for open deals, past for closed deals",
      "rationale": "Close dates should match deal stage",
      "automatable": true,
      "detection_method": "date_validation",
      "false_positive_rate": "very_low",
      "status": "approved"
    }
  ]
}


